{
  "schemaVersion": 1,
  "problemId": "bssc-sum-capacity",
  "beforeKnowledgeStateDigest": "sha256:c9458133e92111ac4df0542400598af0595ce964dd3c89b47efec0bf38b1d344",
  "afterKnowledgeStateDigest": "sha256:3e9323e362b1000d99bb9bf0c32ba56b059c908532558321036f0f6ffceb24f1",
  "preserved": [
    {
      "entityKind": "item",
      "entityId": "root/code-structure-converse/code-induced-dependence-balance",
      "beforeDigest": "sha256:f7f13394e11395e8d2f2728659d807142ed525017b688668eefdbfd92b06810d",
      "afterDigest": "sha256:f7f13394e11395e8d2f2728659d807142ed525017b688668eefdbfd92b06810d"
    },
    {
      "entityKind": "item",
      "entityId": "root/code-structure-converse/copy-extension-proof",
      "beforeDigest": "sha256:7d4d8300feed467f40d7cab85ca12c51db03fb897daf2c88ae3aca9e8b11d2bf",
      "afterDigest": "sha256:7d4d8300feed467f40d7cab85ca12c51db03fb897daf2c88ae3aca9e8b11d2bf"
    },
    {
      "entityKind": "item",
      "entityId": "root/code-structure-converse/entropy-copy-no-go",
      "beforeDigest": "sha256:4d3e3bb55a0cf45bcf1ed21e6dc7fbbc3462691f9b2907fa300128bd53a97d83",
      "afterDigest": "sha256:4d3e3bb55a0cf45bcf1ed21e6dc7fbbc3462691f9b2907fa300128bd53a97d83"
    },
    {
      "entityKind": "item",
      "entityId": "root/code-structure-converse/entropy-counterfeit-witness",
      "beforeDigest": "sha256:051254fb85f0e7177352428a4a9c735952678f44d3b7ed4242885bd43e8a9a56",
      "afterDigest": "sha256:051254fb85f0e7177352428a4a9c735952678f44d3b7ed4242885bd43e8a9a56"
    },
    {
      "entityKind": "item",
      "entityId": "root/code-structure-converse/exact-witness-checker",
      "beforeDigest": "sha256:caeffc0ea1de4056a6c4e5691e5bf171b8d8197a6eae501fe6f1d8c1921d2e30",
      "afterDigest": "sha256:caeffc0ea1de4056a6c4e5691e5bf171b8d8197a6eae501fe6f1d8c1921d2e30"
    },
    {
      "entityKind": "item",
      "entityId": "root/code-structure-converse/finite-block-balance-proof",
      "beforeDigest": "sha256:6b5eb4b706c1b19bdc51166ed41e9daa809d20f3bca4deaa44903d8fa8d8de3b",
      "afterDigest": "sha256:6b5eb4b706c1b19bdc51166ed41e9daa809d20f3bca4deaa44903d8fa8d8de3b"
    },
    {
      "entityKind": "item",
      "entityId": "root/multiletter-marton-achievability/conditional-product-ledger-verifier",
      "beforeDigest": "sha256:cd0afa6704c01622119f28cd6179a03864e72b2d7b5f474de28c9d7ef26e4a8b",
      "afterDigest": "sha256:cd0afa6704c01622119f28cd6179a03864e72b2d7b5f474de28c9d7ef26e4a8b"
    },
    {
      "entityKind": "item",
      "entityId": "root/multiletter-marton-achievability/conditional-product-marton-no-gain",
      "beforeDigest": "sha256:8172104c2911c7e4dbafbe6bf7b79de1095a650b662e67c36373ffeebbfac4d8",
      "afterDigest": "sha256:8172104c2911c7e4dbafbe6bf7b79de1095a650b662e67c36373ffeebbfac4d8"
    },
    {
      "entityKind": "item",
      "entityId": "root/multiletter-marton-achievability/conditional-product-tensorization-proof",
      "beforeDigest": "sha256:a37a1e1472a7541cb6687e91e0f31a31cda6f831129340b6427687e1ef3ab5a4",
      "afterDigest": "sha256:a37a1e1472a7541cb6687e91e0f31a31cda6f831129340b6427687e1ef3ab5a4"
    },
    {
      "entityKind": "item",
      "entityId": "root/multiletter-marton-achievability/four-padding-correlation-test-proof",
      "beforeDigest": "sha256:85971b50035962959cd17bf67260eba6c21b38b4d552d2b6e811cee7048761bc",
      "afterDigest": "sha256:85971b50035962959cd17bf67260eba6c21b38b4d552d2b6e811cee7048761bc"
    },
    {
      "entityKind": "item",
      "entityId": "root/multiletter-marton-achievability/padding-correlation-test-verifier",
      "beforeDigest": "sha256:a89ef3c824e38b4c4c6a61157dbc100a808ac9d1da6dbc4e5c361326c9a5678f",
      "afterDigest": "sha256:a89ef3c824e38b4c4c6a61157dbc100a808ac9d1da6dbc4e5c361326c9a5678f"
    },
    {
      "entityKind": "item",
      "entityId": "root/multiletter-marton-achievability/receiver-skew-marton-midpoint-proof",
      "beforeDigest": "sha256:f00a5d42db6aacc14e6f6cac59c6816fd0411d60b58ba1044c23a2563dcc02e8",
      "afterDigest": "sha256:f00a5d42db6aacc14e6f6cac59c6816fd0411d60b58ba1044c23a2563dcc02e8"
    },
    {
      "entityKind": "item",
      "entityId": "root/multiletter-marton-achievability/tuple-correlation-residual-proof",
      "beforeDigest": "sha256:e74c73481b7930ae355340e99ebd1e3a6b337fcee8ad33dead0970ca01516438",
      "afterDigest": "sha256:e74c73481b7930ae355340e99ebd1e3a6b337fcee8ad33dead0970ca01516438"
    },
    {
      "entityKind": "item",
      "entityId": "root/multiletter-marton-achievability/two-letter-marton-two-symbol-pruning",
      "beforeDigest": "sha256:0e4a7a08da51a30d884937b3df25762826b2dff0aa0295e67cd180515536eb57",
      "afterDigest": "sha256:0e4a7a08da51a30d884937b3df25762826b2dff0aa0295e67cd180515536eb57"
    },
    {
      "entityKind": "item",
      "entityId": "root/multiletter-marton-achievability/two-letter-padding-correlation-tests",
      "beforeDigest": "sha256:759cc1df36c1895c4a0b43cdd3e0a1154471c4855c5ae190d5a6dcce8edc75af",
      "afterDigest": "sha256:759cc1df36c1895c4a0b43cdd3e0a1154471c4855c5ae190d5a6dcce8edc75af"
    },
    {
      "entityKind": "item",
      "entityId": "root/multiletter-marton-achievability/two-symbol-support-certificate-verifier",
      "beforeDigest": "sha256:a5acaac3a8e82bc75fe10b8efcb6093090ec0c0c6fcd5161fb15539037983cdb",
      "afterDigest": "sha256:a5acaac3a8e82bc75fe10b8efcb6093090ec0c0c6fcd5161fb15539037983cdb"
    },
    {
      "entityKind": "item",
      "entityId": "root/multiletter-marton-achievability/two-symbol-support-orbit-reduction",
      "beforeDigest": "sha256:c713de13556df00b90a55afdfb16c234a0ccc629c62503fcd0cc879b5e68bc40",
      "afterDigest": "sha256:c713de13556df00b90a55afdfb16c234a0ccc629c62503fcd0cc879b5e68bc40"
    },
    {
      "entityKind": "item",
      "entityId": "root/multiletter-marton-achievability/two-symbol-support-rate-bound-proof",
      "beforeDigest": "sha256:44313ba300c73beac2812e288af245f717e4433bf133fd62a96b1c7d5333580f",
      "afterDigest": "sha256:44313ba300c73beac2812e288af245f717e4433bf133fd62a96b1c7d5333580f"
    },
    {
      "entityKind": "item",
      "entityId": "root/theorem9-auxiliary-receiver-converse/binary-receiver-curve-uniform-continuity-proof",
      "beforeDigest": "sha256:bb31f6057aaba100793d6ddda9bf9dd89fc9c39b1c457f2498920ee143f1ca0e",
      "afterDigest": "sha256:bb31f6057aaba100793d6ddda9bf9dd89fc9c39b1c457f2498920ee143f1ca0e"
    },
    {
      "entityKind": "item",
      "entityId": "root/theorem9-auxiliary-receiver-converse/continuum-bridge-stability-verifier",
      "beforeDigest": "sha256:09ce96254fc2a74582c1b39a1516037ea82a96470aa2877187f73f0184b08f5b",
      "afterDigest": "sha256:09ce96254fc2a74582c1b39a1516037ea82a96470aa2877187f73f0184b08f5b"
    },
    {
      "entityKind": "item",
      "entityId": "root/theorem9-auxiliary-receiver-converse/exact-specialization-auditor",
      "beforeDigest": "sha256:f716717beef0595a3d9f615327044face13cc9eea36a6a50c32cdc589fc0894d",
      "afterDigest": "sha256:f716717beef0595a3d9f615327044face13cc9eea36a6a50c32cdc589fc0894d"
    },
    {
      "entityKind": "item",
      "entityId": "root/theorem9-auxiliary-receiver-converse/finite-grid-q0-verifier",
      "beforeDigest": "sha256:18d04fb12d09c06a853c0ae44be1bade0c0dc9867cb289f26cd2f64a829d2651",
      "afterDigest": "sha256:18d04fb12d09c06a853c0ae44be1bade0c0dc9867cb289f26cd2f64a829d2651"
    },
    {
      "entityKind": "item",
      "entityId": "root/theorem9-auxiliary-receiver-converse/finite-grid-receiver-cardinality-proof",
      "beforeDigest": "sha256:aada0756004af30b2683e5c652a8a58a38431c83c90e3dbb649d818df48c2202",
      "afterDigest": "sha256:aada0756004af30b2683e5c652a8a58a38431c83c90e3dbb649d818df48c2202"
    },
    {
      "entityKind": "item",
      "entityId": "root/theorem9-auxiliary-receiver-converse/finite-grid-receiver-cardinality-reduction",
      "beforeDigest": "sha256:6227413845cfd199bef29f2a3b9224d41a037dc5597692c2729ad4922a3e8e2e",
      "afterDigest": "sha256:6227413845cfd199bef29f2a3b9224d41a037dc5597692c2729ad4922a3e8e2e"
    },
    {
      "entityKind": "item",
      "entityId": "root/theorem9-auxiliary-receiver-converse/fixed-pair-bssc-upper-bound",
      "beforeDigest": "sha256:b6fd22721828ab8d582318d9b30db0c461e45d14645941aeae821e1c741aa034",
      "afterDigest": "sha256:b6fd22721828ab8d582318d9b30db0c461e45d14645941aeae821e1c741aa034"
    },
    {
      "entityKind": "item",
      "entityId": "root/theorem9-auxiliary-receiver-converse/fixed-pair-certificate-verifier",
      "beforeDigest": "sha256:b55b6c0b9cf9a4c7502a35a25fca0d9765591101d317b70f00eb95ce4fe31b94",
      "afterDigest": "sha256:b55b6c0b9cf9a4c7502a35a25fca0d9765591101d317b70f00eb95ce4fe31b94"
    },
    {
      "entityKind": "item",
      "entityId": "root/theorem9-auxiliary-receiver-converse/fixed-pair-continuous-weak-duality-proof",
      "beforeDigest": "sha256:d51ad0e25ba4cc18bda91d6a42951a45f28a7a90926e732aad0e70c7bc3b3066",
      "afterDigest": "sha256:d51ad0e25ba4cc18bda91d6a42951a45f28a7a90926e732aad0e70c7bc3b3066"
    },
    {
      "entityKind": "item",
      "entityId": "root/theorem9-auxiliary-receiver-converse/fixed-pair-six-row-dual-reduction",
      "beforeDigest": "sha256:797beba801ed958d90b7fdbb66f8b50da01262b4077755c0eabf4f2c93b4b66e",
      "afterDigest": "sha256:797beba801ed958d90b7fdbb66f8b50da01262b4077755c0eabf4f2c93b4b66e"
    },
    {
      "entityKind": "item",
      "entityId": "root/theorem9-auxiliary-receiver-converse/generalized-receiver-curve-compactness-proof",
      "beforeDigest": "sha256:28c3609d950f5f4c9e0d479c45eb0f03271dd9d440ec6ab1149f35ddb48f7fba",
      "afterDigest": "sha256:28c3609d950f5f4c9e0d479c45eb0f03271dd9d440ec6ab1149f35ddb48f7fba"
    },
    {
      "entityKind": "item",
      "entityId": "root/theorem9-auxiliary-receiver-converse/input-only-product-marginal-reduction",
      "beforeDigest": "sha256:0347b89079fadc3bedf44a83512b6b3b0121e83b0b7c194b8b86ea1d9410b75c",